"ID","Subreddit","Score","Comment Count","Title","URL","Permalink","NSFW?","Spoiler?","Date","Time"
"1","worldnews","5508","710","Russia's Putin to make first foreign trip since launching Ukraine war","https://www.msn.com/en-gb/news/world/russia-s-putin-to-make-first-foreign-trip-since-launching-ukraine-war/ar-AAYSVFM?ocid=msedgdhphdr&cvid=f08c0c3614274c2db7ab21686907a67c","https://www.reddit.com/r/worldnews/comments/vl7m3h/russias_putin_to_make_first_foreign_trip_since/","No","No","23 Jul 2022","17:54:44"
"2","worldnews","2593","181","Putin's war has killed 343 children in Ukraine, prosecutor general says","https://www.newsweek.com/putins-war-has-killed-343-children-ukraine-prosecutor-general-says-1721097","https://www.reddit.com/r/worldnews/comments/vp5cry/putins_war_has_killed_343_children_in_ukraine/","No","No","23 Jul 2022","17:54:44"
"3","worldnews","2584","200","We need 'lots of drones' from the West to help defeat Vladimir Putin, Ukraine minister says","https://www.msn.com/en-us/news/world/we-need-lots-of-drones-from-the-west-to-help-defeat-vladimir-putin-ukraine-minister-says/ar-AAZpSoT?ocid=EMMX&cvid=912e8c6685aa4a5f95f02e7c5ca40b89","https://www.reddit.com/r/worldnews/comments/vvq5nw/we_need_lots_of_drones_from_the_west_to_help/","No","No","23 Jul 2022","17:54:44"
"4","worldnews","2523","81","Putin's military stole famous artwork from Ukraine museum: Mariupol Council","https://www.newsweek.com/putins-military-stole-famous-artwork-ukraine-museum-mariupol-council-1722614","https://www.reddit.com/r/worldnews/comments/vtq3b4/putins_military_stole_famous_artwork_from_ukraine/","No","No","23 Jul 2022","17:54:44"
"5","worldnews","2088","296","""Putin's ideology is homophobia"": Ukraine's LGBTQ+ community fights for freedom on the frontline","https://www.cbsnews.com/news/ukraines-lgbtq-community-fights-for-freedom-russia-vladimir-putin/","https://www.reddit.com/r/worldnews/comments/vrn1ps/putins_ideology_is_homophobia_ukraines_lgbtq/","No","No","23 Jul 2022","17:54:44"
"6","worldnews","1672","151","Putin's invasion of Ukraine is guaranteed to cause a two-year food crisis, Western officials warn","https://www.telegraph.co.uk/business/2022/06/23/putins-invasion-ukraine-guaranteed-cause-two-year-food-crisis/","https://www.reddit.com/r/worldnews/comments/vj4lf4/putins_invasion_of_ukraine_is_guaranteed_to_cause/","No","No","23 Jul 2022","17:54:44"
"7","worldnews","1478","60","Turkey Detains Russia Ship Ukraine Says Stealing Grain on Putin Orders","https://www.businessinsider.com/turkey-detains-russian-ship-that-ukraine-says-full-stolen-grain-2022-7","https://www.reddit.com/r/worldnews/comments/vra5nd/turkey_detains_russia_ship_ukraine_says_stealing/","No","No","23 Jul 2022","17:54:44"
"8","worldnews","1436","229","Ukraine war: CIA chief says no intelligence that Putin is in bad health","https://www.bbc.com/news/world-europe-62246914","https://www.reddit.com/r/worldnews/comments/w45wzk/ukraine_war_cia_chief_says_no_intelligence_that/","No","No","23 Jul 2022","17:54:44"
"9","worldnews","1421","316","Putin, in Tehran, gets strong support from Iran over Ukraine","https://apnews.com/article/russia-ukraine-putin-syria-iran-289c3422c8980e7650dbde2c326d248a","https://www.reddit.com/r/worldnews/comments/w33hfn/putin_in_tehran_gets_strong_support_from_iran/","No","No","23 Jul 2022","17:54:44"
"10","worldnews","734","383","Boris Johnson says there'd be no war in Ukraine if Vladimir Putin 'were a woman'","https://eu.usatoday.com/story/news/world/2022/06/29/boris-johnson-ukraine-vladimir-putin-woman/7764976001/","https://www.reddit.com/r/worldnews/comments/vnhrb4/boris_johnson_says_thered_be_no_war_in_ukraine_if/","No","No","23 Jul 2022","17:54:44"
"11","worldnews","621","12","Russia-Ukraine war: Priest detained for criticising Putin","https://www.bbc.com/news/world-62151553","https://www.reddit.com/r/worldnews/comments/w0tm78/russiaukraine_war_priest_detained_for_criticising/","No","No","23 Jul 2022","17:54:44"
"12","worldnews","555","97","Putin's Top Ally Doesn't Want to Enter Ukraine War: Report","https://www.newsweek.com/putins-top-ally-doesnt-want-enter-ukraine-war-report-1724047","https://www.reddit.com/r/worldnews/comments/vxn935/putins_top_ally_doesnt_want_to_enter_ukraine_war/","No","No","23 Jul 2022","17:54:44"
"13","worldnews","293","92","Putin visits Iran for first trip outside former U.S.S.R. since Ukraine war","https://www.reuters.com/world/putin-visits-iran-first-trip-outside-former-ussr-since-ukraine-war-2022-07-18/","https://www.reddit.com/r/worldnews/comments/w225ls/putin_visits_iran_for_first_trip_outside_former/","No","No","23 Jul 2022","17:54:44"
"14","worldnews","249","237","Ukraine war: Johnson says if Putin were a woman he would not have invaded","https://www.bbc.com/news/uk-61976526","https://www.reddit.com/r/worldnews/comments/vn89g2/ukraine_war_johnson_says_if_putin_were_a_woman_he/","No","No","23 Jul 2022","17:54:44"
"15","worldnews","192","47","German Chancellor Olaf Scholz says Putin is ready to wage war in Ukraine for ""a long time""","https://www.cbsnews.com/news/ukraine-russia-olaf-scholz-interview-margaret-brennan-putin-war/","https://www.reddit.com/r/worldnews/comments/vorkc3/german_chancellor_olaf_scholz_says_putin_is_ready/","No","No","23 Jul 2022","17:54:44"
"16","worldnews","178","34","Jokowi says Putin agrees to sea route for Ukraine wheat exports","https://asia.nikkei.com/Politics/Ukraine-war/Jokowi-says-Putin-agrees-to-sea-route-for-Ukraine-wheat-exports","https://www.reddit.com/r/worldnews/comments/vpifov/jokowi_says_putin_agrees_to_sea_route_for_ukraine/","No","No","23 Jul 2022","17:54:44"
"17","worldnews","137","15","25,000 of Vladimir Putin's troops have been killed in Ukraine, says UK Defence Secretary","https://www.standard.co.uk/news/politics/uk-defence-spending-russia-war-ukraine-ben-wallace-nato-boris-johnson-b1009020.html","https://www.reddit.com/r/worldnews/comments/vnimrh/25000_of_vladimir_putins_troops_have_been_killed/","No","No","23 Jul 2022","17:54:44"
"18","worldnews","114","37","Ukraine war latest: Indonesia leader hands Zelensky note to Putin","https://www.bbc.com/news/live/world-europe-61987663","https://www.reddit.com/r/worldnews/comments/voejyt/ukraine_war_latest_indonesia_leader_hands/","No","No","23 Jul 2022","17:54:44"
"19","worldnews","108","31","Russia's Putin to make first foreign trips since launching Ukraine war","https://www.reuters.com/world/europe/russias-putin-make-first-foreign-trip-since-launching-ukraine-war-2022-06-26/","https://www.reddit.com/r/worldnews/comments/vljpq0/russias_putin_to_make_first_foreign_trips_since/","No","No","23 Jul 2022","17:54:44"
"20","worldnews","103","24","In meeting with Jokowi, Putin downplays Ukraine grain blockage","https://www.thejakartapost.com/world/2022/06/30/in-meeting-with-jokowi-putin-downplays-ukraine-grain-blockage.html","https://www.reddit.com/r/worldnews/comments/vpwilz/in_meeting_with_jokowi_putin_downplays_ukraine/","No","No","23 Jul 2022","17:54:44"
"21","worldnews","81","29","Putin says Ukraine is heading for 'tragedy,' Kramatorsk city prepares its defence","https://www.reuters.com/world/ukraine-raises-flag-recaptured-island-loses-key-supporter-uks-johnson-2022-07-07/","https://www.reddit.com/r/worldnews/comments/vtxvnd/putin_says_ukraine_is_heading_for_tragedy/","No","No","23 Jul 2022","17:54:44"
"22","worldnews","75","26","Ukraine war: CIA chief says no intelligence that Putin is in bad health","https://www.bbc.co.uk/news/world-europe-62246914","https://www.reddit.com/r/worldnews/comments/w4bvpy/ukraine_war_cia_chief_says_no_intelligence_that/","No","No","23 Jul 2022","17:54:44"
"23","worldnews","25","71","Putin asks Ukraine to brace for worst, says Russia has barely started","https://www.business-standard.com/article/international/putin-asks-ukraine-to-brace-for-worst-says-russia-has-barely-started-122070800008_1.html?utm_source=SEO&utm_medium=ST","https://www.reddit.com/r/worldnews/comments/w08kn4/putin_asks_ukraine_to_brace_for_worst_says_russia/","No","No","23 Jul 2022","17:54:44"
"24","worldnews","21","15","Ukraine war: Putin visits Iran in rare international trip","https://www.bbc.co.uk/news/world-europe-62218696","https://www.reddit.com/r/worldnews/comments/w2v68l/ukraine_war_putin_visits_iran_in_rare/","No","No","23 Jul 2022","17:54:44"
"25","worldnews","20","15","Putin heads to Iran for talks with Raisi and Erdogan, in shadow of Ukraine war","https://www.timesofisrael.com/putin-heads-to-iran-for-talks-with-raisi-and-erdogan-in-shadow-of-ukraine-war/","https://www.reddit.com/r/worldnews/comments/w2pdkd/putin_heads_to_iran_for_talks_with_raisi_and/","No","No","23 Jul 2022","17:54:44"
